{"analysis_mode":"descriptive_scripted_only","condition_order":["clean","fault"],"execution_order":["smoke-cbb21c3310670e94","smoke-c48fa280c6ac995f","smoke-344964c6f316ed61","smoke-4cf932498d57df11","smoke-6e3ee3b647636751","smoke-549e67744f002499","smoke-727980f600789325","smoke-d9ce0a19bf0dbb2c","smoke-8b7062b7798562ab","smoke-2a3a5627af7094f5","smoke-09976378e475a3cf","smoke-f1018d8346541ce5","smoke-34b0de155fbe72c6","smoke-eb29581d1abd1478","smoke-f200c5f068803cd9","smoke-f816cdc1b1864e46","smoke-7f05f134ccc99017","smoke-778779ac784c1c31","smoke-1b4048fb13b5e069","smoke-a7174cd421d377ef","smoke-76f5971bf0b4676c","smoke-4e067e9eaf9a761d","smoke-15a046d808754e02","smoke-65d4551078c105b1","smoke-528b9f69d3da2687","smoke-067ef79c6f6655ed","smoke-bbc14527291e67c1","smoke-d15d3c91cad09aff","smoke-13663e727c3ee705","smoke-59e407a394069b94","smoke-9daa4e663d2e49e9","smoke-fe3258c8b219174c","smoke-215a42bfad695dcd","smoke-cd12ee646e6f51e5","smoke-5a4d1eabb78e2ec9","smoke-069dc24e8b15380f","smoke-04153ab62957e045","smoke-17aecb41a7b33aab","smoke-3afc06ac353090db","smoke-f97e7bbcf5be13e3","smoke-b86a9892088675ea","smoke-5a70cdb0dec9085d","smoke-2a90f56c85827a68","smoke-3b1b2e746a74e1c6","smoke-ec7b663d3d2108e5","smoke-7fdad1c8676b24ae","smoke-e807a8c946287b8c","smoke-b9421f6507afe81c","smoke-fe8eb8a4dc138211","smoke-4f818bd4587bda03","smoke-69aea92635c96034","smoke-59480cbe25b2bc3a","smoke-e58404025e405f8b","smoke-d3cd646c92cc9a47"],"expected_cells":["{\"condition\":\"fault\",\"environment_seed\":0,\"model_binding\":\"scripted-policy\",\"runtime\":\"R0\",\"sampling_trial\":0,\"task_template_id\":\"smoke.counter.increment\"}","{\"condition\":\"clean\",\"environment_seed\":0,\"model_binding\":\"scripted-policy\",\"runtime\":\"R1\",\"sampling_trial\":0,\"task_template_id\":\"smoke.counter.increment\"}","{\"condition\":\"fault\",\"environment_seed\":0,\"model_binding\":\"scripted-policy\",\"runtime\":\"R2\",\"sampling_trial\":0,\"task_template_id\":\"smoke.counter.increment\"}","{\"condition\":\"clean\",\"environment_seed\":0,\"model_binding\":\"scripted-policy\",\"runtime\":\"R0\",\"sampling_trial\":0,\"task_template_id\":\"smoke.counter.increment\"}","{\"condition\":\"fault\",\"environment_seed\":0,\"model_binding\":\"scripted-policy\",\"runtime\":\"R1\",\"sampling_trial\":0,\"task_template_id\":\"smoke.counter.increment\"}","{\"condition\":\"clean\",\"environment_seed\":0,\"model_binding\":\"scripted-policy\",\"runtime\":\"R2\",\"sampling_trial\":0,\"task_template_id\":\"smoke.counter.increment\"}","{\"condition\":\"clean\",\"environment_seed\":2,\"model_binding\":\"scripted-policy\",\"runtime\":\"R1\",\"sampling_trial\":0,\"task_template_id\":\"smoke.counter.increment\"}","{\"condition\":\"clean\",\"environment_seed\":2,\"model_binding\":\"scripted-policy\",\"runtime\":\"R0\",\"sampling_trial\":0,\"task_template_id\":\"smoke.counter.increment\"}","{\"condition\":\"fault\",\"environment_seed\":2,\"model_binding\":\"scripted-policy\",\"runtime\":\"R2\",\"sampling_trial\":0,\"task_template_id\":\"smoke.counter.increment\"}","{\"condition\":\"fault\",\"environment_seed\":2,\"model_binding\":\"scripted-policy\",\"runtime\":\"R1\",\"sampling_trial\":0,\"task_template_id\":\"smoke.counter.increment\"}","{\"condition\":\"clean\",\"environment_seed\":2,\"model_binding\":\"scripted-policy\",\"runtime\":\"R2\",\"sampling_trial\":0,\"task_template_id\":\"smoke.counter.increment\"}","{\"condition\":\"fault\",\"environment_seed\":2,\"model_binding\":\"scripted-policy\",\"runtime\":\"R0\",\"sampling_trial\":0,\"task_template_id\":\"smoke.counter.increment\"}","{\"condition\":\"clean\",\"environment_seed\":2,\"model_binding\":\"scripted-policy\",\"runtime\":\"R2\",\"sampling_trial\":2,\"task_template_id\":\"smoke.counter.increment\"}","{\"condition\":\"clean\",\"environment_seed\":2,\"model_binding\":\"scripted-policy\",\"runtime\":\"R1\",\"sampling_trial\":2,\"task_template_id\":\"smoke.counter.increment\"}","{\"condition\":\"fault\",\"environment_seed\":2,\"model_binding\":\"scripted-policy\",\"runtime\":\"R2\",\"sampling_trial\":2,\"task_template_id\":\"smoke.counter.increment\"}","{\"condition\":\"fault\",\"environment_seed\":2,\"model_binding\":\"scripted-policy\",\"runtime\":\"R0\",\"sampling_trial\":2,\"task_template_id\":\"smoke.counter.increment\"}","{\"condition\":\"fault\",\"environment_seed\":2,\"model_binding\":\"scripted-policy\",\"runtime\":\"R1\",\"sampling_trial\":2,\"task_template_id\":\"smoke.counter.increment\"}","{\"condition\":\"clean\",\"environment_seed\":2,\"model_binding\":\"scripted-policy\",\"runtime\":\"R0\",\"sampling_trial\":2,\"task_template_id\":\"smoke.counter.increment\"}","{\"condition\":\"clean\",\"environment_seed\":1,\"model_binding\":\"scripted-policy\",\"runtime\":\"R1\",\"sampling_trial\":1,\"task_template_id\":\"smoke.counter.increment\"}","{\"condition\":\"clean\",\"environment_seed\":1,\"model_binding\":\"scripted-policy\",\"runtime\":\"R0\",\"sampling_trial\":1,\"task_template_id\":\"smoke.counter.increment\"}","{\"condition\":\"clean\",\"environment_seed\":1,\"model_binding\":\"scripted-policy\",\"runtime\":\"R2\",\"sampling_trial\":1,\"task_template_id\":\"smoke.counter.increment\"}","{\"condition\":\"fault\",\"environment_seed\":1,\"model_binding\":\"scripted-policy\",\"runtime\":\"R1\",\"sampling_trial\":1,\"task_template_id\":\"smoke.counter.increment\"}","{\"condition\":\"fault\",\"environment_seed\":1,\"model_binding\":\"scripted-policy\",\"runtime\":\"R0\",\"sampling_trial\":1,\"task_template_id\":\"smoke.counter.increment\"}","{\"condition\":\"fault\",\"environment_seed\":1,\"model_binding\":\"scripted-policy\",\"runtime\":\"R2\",\"sampling_trial\":1,\"task_template_id\":\"smoke.counter.increment\"}","{\"condition\":\"clean\",\"environment_seed\":0,\"model_binding\":\"scripted-policy\",\"runtime\":\"R0\",\"sampling_trial\":2,\"task_template_id\":\"smoke.counter.increment\"}","{\"condition\":\"fault\",\"environment_seed\":0,\"model_binding\":\"scripted-policy\",\"runtime\":\"R1\",\"sampling_trial\":2,\"task_template_id\":\"smoke.counter.increment\"}","{\"condition\":\"clean\",\"environment_seed\":0,\"model_binding\":\"scripted-policy\",\"runtime\":\"R2\",\"sampling_trial\":2,\"task_template_id\":\"smoke.counter.increment\"}","{\"condition\":\"fault\",\"environment_seed\":0,\"model_binding\":\"scripted-policy\",\"runtime\":\"R0\",\"sampling_trial\":2,\"task_template_id\":\"smoke.counter.increment\"}","{\"condition\":\"fault\",\"environment_seed\":0,\"model_binding\":\"scripted-policy\",\"runtime\":\"R2\",\"sampling_trial\":2,\"task_template_id\":\"smoke.counter.increment\"}","{\"condition\":\"clean\",\"environment_seed\":0,\"model_binding\":\"scripted-policy\",\"runtime\":\"R1\",\"sampling_trial\":2,\"task_template_id\":\"smoke.counter.increment\"}","{\"condition\":\"clean\",\"environment_seed\":1,\"model_binding\":\"scripted-policy\",\"runtime\":\"R2\",\"sampling_trial\":0,\"task_template_id\":\"smoke.counter.increment\"}","{\"condition\":\"fault\",\"environment_seed\":1,\"model_binding\":\"scripted-policy\",\"runtime\":\"R0\",\"sampling_trial\":0,\"task_template_id\":\"smoke.counter.increment\"}","{\"condition\":\"fault\",\"environment_seed\":1,\"model_binding\":\"scripted-policy\",\"runtime\":\"R2\",\"sampling_trial\":0,\"task_template_id\":\"smoke.counter.increment\"}","{\"condition\":\"clean\",\"environment_seed\":1,\"model_binding\":\"scripted-policy\",\"runtime\":\"R1\",\"sampling_trial\":0,\"task_template_id\":\"smoke.counter.increment\"}","{\"condition\":\"clean\",\"environment_seed\":1,\"model_binding\":\"scripted-policy\",\"runtime\":\"R0\",\"sampling_trial\":0,\"task_template_id\":\"smoke.counter.increment\"}","{\"condition\":\"fault\",\"environment_seed\":1,\"model_binding\":\"scripted-policy\",\"runtime\":\"R1\",\"sampling_trial\":0,\"task_template_id\":\"smoke.counter.increment\"}","{\"condition\":\"fault\",\"environment_seed\":2,\"model_binding\":\"scripted-policy\",\"runtime\":\"R2\",\"sampling_trial\":1,\"task_template_id\":\"smoke.counter.increment\"}","{\"condition\":\"fault\",\"environment_seed\":2,\"model_binding\":\"scripted-policy\",\"runtime\":\"R1\",\"sampling_trial\":1,\"task_template_id\":\"smoke.counter.increment\"}","{\"condition\":\"clean\",\"environment_seed\":2,\"model_binding\":\"scripted-policy\",\"runtime\":\"R2\",\"sampling_trial\":1,\"task_template_id\":\"smoke.counter.increment\"}","{\"condition\":\"clean\",\"environment_seed\":2,\"model_binding\":\"scripted-policy\",\"runtime\":\"R0\",\"sampling_trial\":1,\"task_template_id\":\"smoke.counter.increment\"}","{\"condition\":\"clean\",\"environment_seed\":2,\"model_binding\":\"scripted-policy\",\"runtime\":\"R1\",\"sampling_trial\":1,\"task_template_id\":\"smoke.counter.increment\"}","{\"condition\":\"fault\",\"environment_seed\":2,\"model_binding\":\"scripted-policy\",\"runtime\":\"R0\",\"sampling_trial\":1,\"task_template_id\":\"smoke.counter.increment\"}","{\"condition\":\"fault\",\"environment_seed\":1,\"model_binding\":\"scripted-policy\",\"runtime\":\"R2\",\"sampling_trial\":2,\"task_template_id\":\"smoke.counter.increment\"}","{\"condition\":\"fault\",\"environment_seed\":1,\"model_binding\":\"scripted-policy\",\"runtime\":\"R1\",\"sampling_trial\":2,\"task_template_id\":\"smoke.counter.increment\"}","{\"condition\":\"clean\",\"environment_seed\":1,\"model_binding\":\"scripted-policy\",\"runtime\":\"R0\",\"sampling_trial\":2,\"task_template_id\":\"smoke.counter.increment\"}","{\"condition\":\"clean\",\"environment_seed\":1,\"model_binding\":\"scripted-policy\",\"runtime\":\"R1\",\"sampling_trial\":2,\"task_template_id\":\"smoke.counter.increment\"}","{\"condition\":\"clean\",\"environment_seed\":1,\"model_binding\":\"scripted-policy\",\"runtime\":\"R2\",\"sampling_trial\":2,\"task_template_id\":\"smoke.counter.increment\"}","{\"condition\":\"fault\",\"environment_seed\":1,\"model_binding\":\"scripted-policy\",\"runtime\":\"R0\",\"sampling_trial\":2,\"task_template_id\":\"smoke.counter.i